{"aoa_version":1,"content_pack_id":"material.additive.v1","fallback_glyph_id":539,"font_id":"unifont-17.0.04","font_sha256":"d1f664a9753b9c6b7ff357128749e32b5d3eee90c7c03618363fabd43a39b5b7","glyph_index":{"1876":[0,0,160,16,176],"1877":[0,16,160,32,176],"1878":[0,32,160,48,176],"1879":[0,48,160,64,176],"512":[0,0,0,16,16],"513":[0,16,0,32,16],"514":[0,32,0,48,16],"515":[0,48,0,64,16],"516":[0,64,0,80,16],"517":[0,80,0,96,16],"518":[0,96,0,112,16],"519":[0,112,0,128,16],"520":[0,128,0,144,16],"521":[0,144,0,160,16],"522":[0,160,0,176,16],"523":[0,176,0,192,16],"524":[0,192,0,208,16],"525":[0,208,0,224,16],"526":[0,224,0,240,16],"527":[0,240,0,256,16],"528":[0,0,16,16,32],"529":[0,16,16,32,32],"530":[0,32,16,48,32],"531":[0,48,16,64,32],"532":[0,64,16,80,32],"533":[0,80,16,96,32],"534":[0,96,16,112,32],"535":[0,112,16,128,32],"536":[0,128,16,144,32],"537":[0,144,16,160,32],"538":[0,160,16,176,32],"539":[0,176,16,192,32],"540":[0,192,16,208,32],"541":[0,208,16,224,32],"542":[0,224,16,240,32],"543":[0,240,16,256,32],"544":[0,0,32,16,48],"545":[0,16,32,32,48],"546":[0,32,32,48,48],"547":[0,48,32,64,48],"548":[0,64,32,80,48],"549":[0,80,32,96,48],"550":[0,96,32,112,48],"551":[0,112,32,128,48],"552":[0,128,32,144,48],"553":[0,144,32,160,48],"554":[0,160,32,176,48],"555":[0,176,32,192,48],"556":[0,192,32,208,48],"557":[0,208,32,224,48],"558":[0,224,32,240,48],"559":[0,240,32,256,48],"560":[0,0,48,16,64],"561":[0,16,48,32,64],"562":[0,32,48,48,64],"563":[0,48,48,64,64],"564":[0,64,48,80,64],"565":[0,80,48,96,64],"566":[0,96,48,112,64],"567":[0,112,48,128,64],"568":[0,128,48,144,64],"569":[0,144,48,160,64],"570":[0,160,48,176,64],"571":[0,176,48,192,64],"572":[0,192,48,208,64],"573":[0,208,48,224,64],"574":[0,224,48,240,64],"575":[0,240,48,256,64],"576":[0,0,64,16,80],"577":[0,16,64,32,80],"578":[0,32,64,48,80],"579":[0,48,64,64,80],"580":[0,64,64,80,80],"581":[0,80,64,96,80],"582":[0,96,64,112,80],"583":[0,112,64,128,80],"584":[0,128,64,144,80],"585":[0,144,64,160,80],"586":[0,160,64,176,80],"587":[0,176,64,192,80],"588":[0,192,64,208,80],"589":[0,208,64,224,80],"590":[0,224,64,240,80],"591":[0,240,64,256,80],"592":[0,0,80,16,96],"593":[0,16,80,32,96],"594":[0,32,80,48,96],"595":[0,48,80,64,96],"596":[0,64,80,80,96],"597":[0,80,80,96,96],"598":[0,96,80,112,96],"599":[0,112,80,128,96],"600":[0,128,80,144,96],"601":[0,144,80,160,96],"602":[0,160,80,176,96],"603":[0,176,80,192,96],"604":[0,192,80,208,96],"605":[0,208,80,224,96],"606":[0,224,80,240,96],"607":[0,240,80,256,96],"608":[0,0,96,16,112],"609":[0,16,96,32,112],"610":[0,32,96,48,112],"611":[0,48,96,64,112],"612":[0,64,96,80,112],"613":[0,80,96,96,112],"614":[0,96,96,112,112],"615":[0,112,96,128,112],"616":[0,128,96,144,112],"617":[0,144,96,160,112],"618":[0,160,96,176,112],"619":[0,176,96,192,112],"620":[0,192,96,208,112],"621":[0,208,96,224,112],"622":[0,224,96,240,112],"623":[0,240,96,256,112],"624":[0,0,112,16,128],"625":[0,16,112,32,128],"626":[0,32,112,48,128],"627":[0,48,112,64,128],"628":[0,64,112,80,128],"629":[0,80,112,96,128],"630":[0,96,112,112,128],"631":[0,112,112,128,128],"632":[0,128,112,144,128],"633":[0,144,112,160,128],"634":[0,160,112,176,128],"635":[0,176,112,192,128],"636":[0,192,112,208,128],"637":[0,208,112,224,128],"638":[0,224,112,240,128],"639":[0,240,112,256,128],"640":[0,0,128,16,144],"641":[0,16,128,32,144],"642":[0,32,128,48,144],"643":[0,48,128,64,144],"644":[0,64,128,80,144],"645":[0,80,128,96,144],"646":[0,96,128,112,144],"647":[0,112,128,128,144],"648":[0,128,128,144,144],"649":[0,144,128,160,144],"650":[0,160,128,176,144],"651":[0,176,128,192,144],"652":[0,192,128,208,144],"653":[0,208,128,224,144],"654":[0,224,128,240,144],"655":[0,240,128,256,144],"656":[0,0,144,16,160],"657":[0,16,144,32,160],"658":[0,32,144,48,160],"659":[0,48,144,64,160],"660":[0,64,144,80,160],"661":[0,80,144,96,160],"662":[0,96,144,112,160],"663":[0,112,144,128,160],"664":[0,128,144,144,160],"665":[0,144,144,160,160],"666":[0,160,144,176,160],"667":[0,176,144,192,160],"668":[0,192,144,208,160],"669":[0,208,144,224,160],"670":[0,224,144,240,160],"671":[0,240,144,256,160]},"lut_hash":"3e30dc003b408eeba866f322afd4f11fb77d1e4e46a60733ba1934fe99a835ba","manifest_hash":"077de379be107288555c7162ad737f0545fc637d43a2cf085051aed578b4aa8e","pages":[{"cell_px":16,"format":"rgba8","height_px":176,"page_binding_kind":"atlas_rect","page_hash":"6f3f65fdd5a79e9572135d75d2c5cbda75b0574f0e4dff735afaf280233450bf","page_id":"page16","url":"material.additive.v1.page16_rgba8.json","width_px":256}],"style_id":"regular"}
